{"$defs":{"matrix":{"items":{"items":{"items":{"type":"integer"},"maxItems":2,"minItems":2,"type":"array"},"minItems":1,"type":"array"},"minItems":1,"type":"array"},"source":{"additionalProperties":false,"properties":{"block_id":{"enum":["GLOBAL_TYPED","GLOBAL_DESCENT","GRADED_CELLULAR","COMPLETE_CARRIER","COMPLETE_QUADRATURE","CPT_ORIENTATION"]},"relative_path":{"minLength":1,"type":"string"},"source_sha256":{"pattern":"^[0-9a-f]{64}$","type":"string"},"span":{"items":false,"maxItems":2,"minItems":2,"prefixItems":[{"minimum":0,"type":"integer"},{"minimum":0,"type":"integer"}],"type":"array"},"span_sha256":{"pattern":"^[0-9a-f]{64}$","type":"string"}},"required":["block_id","relative_path","source_sha256","span","span_sha256"],"type":"object"}},"$id":"urn:rd22:step11:orientation-unitary-carrier:v001","$schema":"https://json-schema.org/draft/2020-12/schema","additionalProperties":false,"properties":{"basis":{"const":["|r_c>","|p_c>","|e_c>"]},"carrier_id":{"const":"U_CELL_ORIENTATION_CANONICAL"},"codomain":{"const":"R_c=span_C{|r_c>,|p_c>,|e_c>}"},"complex_entry_encoding":{"const":"[real_integer,imaginary_integer]"},"domain":{"const":"R_c=span_C{|r_c>,|p_c>,|e_c>}"},"matrices":{"additionalProperties":false,"properties":{"Gamma_cell":{"$ref":"#/$defs/matrix"},"U_c":{"$ref":"#/$defs/matrix"},"b_partial":{"$ref":"#/$defs/matrix"},"b_partial_reversed":{"$ref":"#/$defs/matrix"},"c_partial":{"$ref":"#/$defs/matrix"},"c_partial_reversed":{"$ref":"#/$defs/matrix"},"d_partial":{"$ref":"#/$defs/matrix"}},"required":["Gamma_cell","U_c","b_partial","b_partial_reversed","c_partial","c_partial_reversed","d_partial"],"type":"object"},"orientation_subset_extension":{"type":"object"},"phase_class":{"const":"Ad_(exp(i theta) Gamma_cell)=Ad_(Gamma_cell); canonical representative Gamma_cell"},"schema":{"const":"rd22.step11.orientation-unitary-carrier.v001"},"source_bindings":{"items":{"$ref":"#/$defs/source"},"minItems":4,"type":"array"}},"required":["schema","carrier_id","domain","codomain","basis","complex_entry_encoding","matrices","orientation_subset_extension","phase_class","source_bindings"],"type":"object"}