{"basis":["|r_c>","|p_c>","|e_c>"],"carrier_id":"U_CELL_ORIENTATION_CANONICAL","codomain":"R_c=span_C{|r_c>,|p_c>,|e_c>}","complex_entry_encoding":"[real_integer,imaginary_integer]","domain":"R_c=span_C{|r_c>,|p_c>,|e_c>}","matrices":{"Gamma_cell":[[[1,0],[0,0],[0,0]],[[0,0],[1,0],[0,0]],[[0,0],[0,0],[-1,0]]],"U_c":[[[1,0],[0,0],[0,0]],[[0,0],[1,0],[0,0]],[[0,0],[0,0],[-1,0]]],"b_partial":[[[0,0],[0,0],[-1,0]],[[0,0],[0,0],[1,0]],[[-1,0],[1,0],[0,0]]],"b_partial_reversed":[[[0,0],[0,0],[1,0]],[[0,0],[0,0],[-1,0]],[[1,0],[-1,0],[0,0]]],"c_partial":[[[0,0],[0,0],[0,-1]],[[0,0],[0,0],[0,1]],[[0,1],[0,-1],[0,0]]],"c_partial_reversed":[[[0,0],[0,0],[0,1]],[[0,0],[0,0],[0,-1]],[[0,-1],[0,1],[0,0]]],"d_partial":[[[-1,0]],[[1,0]]]},"orientation_subset_extension":{"formula":"U_O=tensor_(c in K) (Gamma_cell if c in O else I_Rc)","scope":"every finite selected orientation-reversal subset O of K","unitarity":"U_O^*=U_O=U_O^-1"},"phase_class":"Ad_(exp(i theta) Gamma_cell)=Ad_(Gamma_cell); canonical representative Gamma_cell","schema":"rd22.step11.orientation-unitary-carrier.v001","source_bindings":[{"block_id":"GLOBAL_TYPED","relative_path":"review_packets/STAGE7_QSPEC_CANDIDATE_V001/BID_GLOBAL_BOUNDARY_DESCENT_QUASI_FREE_COMPLETENESS_V001.md","source_sha256":"949181d78aca143ebef06eacc4ab1018d43cdf79962ee8c78c350f654a7555dd","span":[1103,1704],"span_sha256":"daeb7bc7b448e78009703e6fc7a7946a76844f7ee6f479327e63ab6ab84057d2"},{"block_id":"GLOBAL_DESCENT","relative_path":"review_packets/STAGE7_QSPEC_CANDIDATE_V001/BID_GLOBAL_BOUNDARY_DESCENT_QUASI_FREE_COMPLETENESS_V001.md","source_sha256":"949181d78aca143ebef06eacc4ab1018d43cdf79962ee8c78c350f654a7555dd","span":[1705,4005],"span_sha256":"fcbb16c6cad76b08a210d55d42a1ce82d165ae3a0adfd63f28ba16f30946d1ce"},{"block_id":"GRADED_CELLULAR","relative_path":"review_packets/STAGE7_QSPEC_CANDIDATE_V001/BID_GRADED_BOUNDARY_SUPERCONNECTION_REPAIR_V001.md","source_sha256":"2215f79cbe69f1de1643427ad5d422b0c3064ff758327e43ff1629de8633f72d","span":[344,1501],"span_sha256":"10262d72110ffaafdcaf4ea0419af4f780b1616e30567a9275c0b1315207ef72"},{"block_id":"COMPLETE_CARRIER","relative_path":"review_packets/STAGE7_QSPEC_CANDIDATE_V001/BID_COMPLETE_ONE_NORMAL_ZERO_FORM_ENUMERATION_V001.md","source_sha256":"50b5a651df2aca90ee47c6f85b2a502461370a652706ebccad871f191565a2d9","span":[386,1377],"span_sha256":"191cf84d2288f532f7d4df410be2c8947ffa006c4bc440a697a4120a9e6f1fde"},{"block_id":"COMPLETE_QUADRATURE","relative_path":"review_packets/STAGE7_QSPEC_CANDIDATE_V001/BID_COMPLETE_ONE_NORMAL_ZERO_FORM_ENUMERATION_V001.md","source_sha256":"50b5a651df2aca90ee47c6f85b2a502461370a652706ebccad871f191565a2d9","span":[3909,4583],"span_sha256":"42188aeee574da63e53aa88a0204f472d59b377c959eb2f6439602d692eb9a7c"},{"block_id":"CPT_ORIENTATION","relative_path":"review_packets/STAGE7_QSPEC_CANDIDATE_V001/BID_CHARGED_CELLULAR_CPT_INTERTWINER_DERIVATION_V001.md","source_sha256":"0322763ac48a4428b432124a6947da81826a41f612efa6803ee9a87317929b98","span":[4185,5830],"span_sha256":"c9fc62a999110e443f87551110e914462029f2dd5a5dd331d7ca202cd894b6c5"}]}